case_id,expected_entities,expected_requirements_dsl,expected_design_dsl,expected_code_contains,expected_semantic_rules,notes
scenario_1_hardware,"computer;motherboard;processor;memory;storage;peripheral;start;shutdown;status","Class Computer Attributes motherboard, processor, memory, storage, peripheral Methods start, shutdown, reportStatus Relation Computer composition Motherboard","Class Computer Attributes motherboard, processor, memory, storage, peripheral Methods start, shutdown, reportStatus Relation Computer composition Motherboard","class Computer;__init__;self;pass","composition between computer and components","Approximate gold standard; replace with exact figure/content if paper provides extract."
scenario_2_editorial,"document;section;paragraph;figure;reference;author;editor;review;validate","Class Document Attributes sections, paragraphs, figures, references Class Author Methods write Class Editor Methods review, validate Relation Author association Document Relation Editor association Document","Class Document Attributes sections, paragraphs, figures, references Class Author Methods write Class Editor Methods review, validate Relation Author association Document Relation Editor association Document","class Document;class Author;class Editor;pass","editor validates document","Approximate gold standard."
scenario_3_library,"library;book;member;loan;borrow;return;penalty","Class Library Methods manage Class Book Class Member Methods borrow, returnLoan Class Loan Class Penalty Relation Member association Loan Relation Loan association Book","Class Library Methods manage Class Book Class Member Methods borrow, returnLoan Class Loan Class Penalty Relation Member association Loan Relation Loan association Book","class Library;class Member;class Loan;pass","late loans create penalty","Approximate gold standard."
ambiguous_implicit_relation,"order;item;customer;message;confirmed","Class Order Class Item Class Customer Class Message Relation Order composition Item Relation Customer association Order","Class Order Class Item Class Customer Class Message Relation Order composition Item Relation Customer association Order","class Order;class Item;class Customer","composition order item","Tests implicit composition."
incomplete_coreference,"car;attributes;getspeed","Class Car Methods getSpeed","Class Car Methods getSpeed","class Car;getSpeed","coreference It refers to Car","Gold is intentionally partial due incomplete input."
out_of_pattern_business_rules,"sensor;event;alert;reading;threshold;operator;incident","Class SensorEvent Attributes reading, threshold Class Alert Methods acknowledge, escalate Class Operator Relation SensorEvent association Alert Relation Operator association Alert","Class SensorEvent Attributes reading, threshold Class Alert Methods acknowledge, escalate Class Operator Relation SensorEvent association Alert Relation Operator association Alert","class SensorEvent;class Alert;acknowledge;escalate","supervisor approval for escalation","Extension beyond static structural extraction."
